{"$schema":"https://json-schema.org/draft/2020-12/schema","$id":"https://ndoracle.org/schema/types/experience-v0.2.json","title":"ND Oracle experience object v0.2","type":"object","additionalProperties":false,"required":["schema_version","id","type","status","provenance","name","description","contexts","reported_by","variability","related_objects","evidence_ids","question_ids"],"properties":{"schema_version":{"const":"0.2"},"id":{"$ref":"https://ndoracle.org/schema/common-v0.2.json#/$defs/identifier"},"type":{"const":"experience"},"status":{"$ref":"https://ndoracle.org/schema/common-v0.2.json#/$defs/status"},"provenance":{"$ref":"https://ndoracle.org/schema/common-v0.2.json#/$defs/provenance"},"name":{"$ref":"https://ndoracle.org/schema/common-v0.2.json#/$defs/nonBlankString"},"description":{"$ref":"https://ndoracle.org/schema/common-v0.2.json#/$defs/nonBlankString"},"contexts":{"type":"array","minItems":1,"items":{"$ref":"https://ndoracle.org/schema/common-v0.2.json#/$defs/nonBlankString"}},"reported_by":{"$ref":"https://ndoracle.org/schema/common-v0.2.json#/$defs/nonBlankString"},"variability":{"$ref":"https://ndoracle.org/schema/common-v0.2.json#/$defs/nonBlankString"},"related_objects":{"type":"array","items":{"$ref":"https://ndoracle.org/schema/common-v0.2.json#/$defs/typedReference"}},"evidence_ids":{"type":"array","items":{"$ref":"https://ndoracle.org/schema/common-v0.2.json#/$defs/identifier"},"uniqueItems":true},"question_ids":{"type":"array","items":{"$ref":"https://ndoracle.org/schema/common-v0.2.json#/$defs/identifier"},"uniqueItems":true}}}