{"schema_version":"0.2","id":"fixture-experience-a","type":"experience","status":"draft","name":"Fixture Experience A","description":"A synthetic report describes the fixture as useful.","contexts":["Synthetic automated test context"],"reported_by":"Synthetic aggregate fixture","variability":"A second synthetic report deliberately differs.","related_objects":[{"type":"concept","id":"fixture-concept"}],"evidence_ids":["fixture-evidence"],"question_ids":["fixture-question"],"provenance":{"created":"2026-08-11","created_by":"test fixture","method":"Synthetic test-only fixture","review_state":"unreviewed_seed","last_reviewed":null}}